{"artifact_visibility":{"evaluation_view/manifest.json":"solver_evaluation_view","evaluation_view/public/prompt.md":"solver_evaluation_view","evaluation_view/public/runtime_contract.json":"solver_evaluation_view","evaluation_view/public/submission.schema.json":"solver_evaluation_view","source_manifest.json":"delivery_audit_only","task.duckdb":"tool_host_only","trusted_tools/toolset.json":"tool_host_only","verifier/README.md":"verifier_only","verifier/__init__.py":"verifier_only","verifier/conftest.py":"verifier_only","verifier/oracle_config.json":"verifier_only","verifier/requirements.lock":"verifier_only","verifier/runtime.py":"verifier_only","verifier/test_contract.py":"verifier_only","verifier/test_data_identity.py":"verifier_only","verifier/test_semantics.py":"verifier_only"},"artifacts":{"evaluation_view/manifest.json":"c276af9eab11ab80b2415059af83658696d251d3ad6ede7b58c2fa5496b459d0","evaluation_view/public/prompt.md":"efac38a4c27c2c17c966b699c442a5182b55a1266d00738a825e1cade692d8b4","evaluation_view/public/runtime_contract.json":"218a17660817ce9a86e2f0e126bdfae55a7fc962d409192c016c47e850cb2948","evaluation_view/public/submission.schema.json":"0ff5987223743c65e8cf57328037fff0bfc18af7eabda2aed43afef71deb0603","source_manifest.json":"d6a03588e89c5f5533470a6bdc5b3962ae43a966dfb18dab3acd0642b9ba63b7","task.duckdb":"caf958a6c04c781c9bdf93f79ecffb6ef90a70b627e3061011baf7e67840a80f","trusted_tools/toolset.json":"ad6e86a610b48f39f3b8cfc2991e4377bf3b408e86b73c2700dfbdd39079c3b3","verifier/README.md":"0f11015dbb7c2c7494c95425d3d7c6d5451da95e0a253e7d22b6378b0ba19870","verifier/__init__.py":"018d3c3857f87e105ed9b17a4bf6405f28aaaf13ee04845976f5d26ba48065ec","verifier/conftest.py":"07ad05acc2b379ccad1b4751b0b0ff172c348be70764e1d27878f52052063e56","verifier/oracle_config.json":"404133266a2fab4076764d41f8590a1307c06af4968515de66b608038ff4d788","verifier/requirements.lock":"df4c512944e19ad7f9df6ab76b0523ef75a14a4ef659941d623f94bfabb3fc17","verifier/runtime.py":"e52e18ebe2403660c73909687bda9703ced5b112f643c295308750cf0c98643c","verifier/test_contract.py":"8b80561ff4cab58892662acf1b5330dddfd9a5006389c8741dfcc53cd0f378a2","verifier/test_data_identity.py":"0a31b79d889bfda62a6004b438593b82e93e0f1811db3a37365c05e82e32ffff","verifier/test_semantics.py":"f290334c25b82579f52dd85ec2f9db7236e8b23890d68fb78073e928c6f54a3d"},"database":{"file_digest":"caf958a6c04c781c9bdf93f79ecffb6ef90a70b627e3061011baf7e67840a80f","logical_checksum":"e0dbf72fa9153bea19fb8fdc8a223bea31f5ec9015b57ac633b4282826efef85","market_content_digest":"2e96d8fff337feaff3e56ea6f6310ec6b288efb40dbe1101a126dd9d30842007","schema_version":"bsm-market-metric-task-duckdb-v2.0.0","snapshot_id":"BSM-MARKET-METRIC-78DDC83F617A7D076D3E4572"},"delivery_status":"PORTABLE_SUITE_VERIFIED","evaluation_view":{"interface_digest":"84f025226cbf3ca29ad06e7cedb8f01aa1aa048e1b94b1df1675847d6244cffb","manifest_digest":"c276af9eab11ab80b2415059af83658696d251d3ad6ede7b58c2fa5496b459d0","path":"evaluation_view"},"method_id":"bsm-mid-iv-bisection80-v1","package_schema_version":"agent-task-package-v3.0.0","public_child_snapshot":{"logical_checksum":"e0dbf72fa9153bea19fb8fdc8a223bea31f5ec9015b57ac633b4282826efef85","revision":1,"snapshot_id":"BSM-MARKET-METRIC-78DDC83F617A7D076D3E4572"},"source_manifest_digest":"d6a03588e89c5f5533470a6bdc5b3962ae43a966dfb18dab3acd0642b9ba63b7","source_task_id":"bsm-mig-v2-b814541a145848248074ad95","target_metric":"iv","task_family":"bsm_greeks","task_id":"bsm-market-iv-v2-78ddc83f617a7d076d3e4572","task_interface_version":"bsm-market-metric-agent-task-v2.0.0","task_version":"2.0.0","toolset":{"digest":"ad6e86a610b48f39f3b8cfc2991e4377bf3b408e86b73c2700dfbdd39079c3b3","path":"trusted_tools/toolset.json"},"variant_id":"bsm_market_implied_iv_v1","verifier":{"id":"quantlib-bsm-market-implied-iv-verifier-v2","oracle_config_digest":"404133266a2fab4076764d41f8590a1307c06af4968515de66b608038ff4d788","runtime_digest":"e52e18ebe2403660c73909687bda9703ced5b112f643c295308750cf0c98643c"}}
