{"artifact_visibility":{"evaluation_view/manifest.json":"solver_evaluation_view","evaluation_view/public/prompt.md":"solver_evaluation_view","evaluation_view/public/runtime_contract.json":"solver_evaluation_view","evaluation_view/public/submission.schema.json":"solver_evaluation_view","source_manifest.json":"delivery_audit_only","task.duckdb":"tool_host_only","trusted_tools/toolset.json":"tool_host_only","verifier/README.md":"verifier_only","verifier/__init__.py":"verifier_only","verifier/conftest.py":"verifier_only","verifier/oracle_config.json":"verifier_only","verifier/requirements.lock":"verifier_only","verifier/runtime.py":"verifier_only","verifier/test_contract.py":"verifier_only","verifier/test_data_identity.py":"verifier_only","verifier/test_semantics.py":"verifier_only"},"artifacts":{"evaluation_view/manifest.json":"4a6812360d8ad99d6c62baa4938f4ed6f498ec265e866d702322f58b1dc8457c","evaluation_view/public/prompt.md":"59ec42cfe078aab3d61b3b95f7d89aae4d2090c6080930de85403ee27d847864","evaluation_view/public/runtime_contract.json":"218a17660817ce9a86e2f0e126bdfae55a7fc962d409192c016c47e850cb2948","evaluation_view/public/submission.schema.json":"be4a9910bd2fdea14550f57a4ced520f7e5747328df1e151a7714d2e42fe5bc7","source_manifest.json":"bf9279491426fe7843973f9199d7836cbb147312e09f7ac27d67bdb4806bec7a","task.duckdb":"9be1ea2833e5b3bf81fc4425bbf67e7b15eb403e92283fd8ab4b73d757e9e946","trusted_tools/toolset.json":"4f39d06b24462ae780994dc8e635981a86823c60caaf4c7a532c99f1221796a0","verifier/README.md":"0f11015dbb7c2c7494c95425d3d7c6d5451da95e0a253e7d22b6378b0ba19870","verifier/__init__.py":"018d3c3857f87e105ed9b17a4bf6405f28aaaf13ee04845976f5d26ba48065ec","verifier/conftest.py":"07ad05acc2b379ccad1b4751b0b0ff172c348be70764e1d27878f52052063e56","verifier/oracle_config.json":"4fe70674a1aa59ecfe71907d64b0e607a5a08f974c55d309bc3663a8761e119a","verifier/requirements.lock":"df4c512944e19ad7f9df6ab76b0523ef75a14a4ef659941d623f94bfabb3fc17","verifier/runtime.py":"e52e18ebe2403660c73909687bda9703ced5b112f643c295308750cf0c98643c","verifier/test_contract.py":"8b80561ff4cab58892662acf1b5330dddfd9a5006389c8741dfcc53cd0f378a2","verifier/test_data_identity.py":"0a31b79d889bfda62a6004b438593b82e93e0f1811db3a37365c05e82e32ffff","verifier/test_semantics.py":"f290334c25b82579f52dd85ec2f9db7236e8b23890d68fb78073e928c6f54a3d"},"database":{"file_digest":"9be1ea2833e5b3bf81fc4425bbf67e7b15eb403e92283fd8ab4b73d757e9e946","logical_checksum":"74900eba4a7364440e60cbf6bbbb3798b4dd09eb29bc25cc69d3a918066c2124","market_content_digest":"e290e0d974572395c24d18a7bb059f3d1cfbca8c06c334bd109a8d86c0f5a7c0","schema_version":"bsm-market-metric-task-duckdb-v2.0.0","snapshot_id":"BSM-MARKET-METRIC-4496A954C269FFA620A5F1C7"},"delivery_status":"PORTABLE_SUITE_VERIFIED","evaluation_view":{"interface_digest":"6f2983569c844ddec5a79f5056dc03109c57a7cba02d43c35eaa25d87b9af33b","manifest_digest":"4a6812360d8ad99d6c62baa4938f4ed6f498ec265e866d702322f58b1dc8457c","path":"evaluation_view"},"method_id":"bsm-mid-iv-bisection80-analytic-gamma-v1","package_schema_version":"agent-task-package-v3.0.0","public_child_snapshot":{"logical_checksum":"74900eba4a7364440e60cbf6bbbb3798b4dd09eb29bc25cc69d3a918066c2124","revision":1,"snapshot_id":"BSM-MARKET-METRIC-4496A954C269FFA620A5F1C7"},"source_manifest_digest":"bf9279491426fe7843973f9199d7836cbb147312e09f7ac27d67bdb4806bec7a","source_task_id":"bsm-mig-v2-ca8a0467c454f53c00a32988","target_metric":"gamma","task_family":"bsm_greeks","task_id":"bsm-market-gamma-v2-4496a954c269ffa620a5f1c7","task_interface_version":"bsm-market-metric-agent-task-v2.0.0","task_version":"2.0.0","toolset":{"digest":"4f39d06b24462ae780994dc8e635981a86823c60caaf4c7a532c99f1221796a0","path":"trusted_tools/toolset.json"},"variant_id":"bsm_market_implied_gamma_v1","verifier":{"id":"quantlib-bsm-market-implied-gamma-verifier-v2","oracle_config_digest":"4fe70674a1aa59ecfe71907d64b0e607a5a08f974c55d309bc3663a8761e119a","runtime_digest":"e52e18ebe2403660c73909687bda9703ced5b112f643c295308750cf0c98643c"}}
