{"artifact_visibility":{"evaluation_view/manifest.json":"solver_evaluation_view","evaluation_view/public/prompt.md":"solver_evaluation_view","evaluation_view/public/runtime_contract.json":"solver_evaluation_view","evaluation_view/public/submission.schema.json":"solver_evaluation_view","source_manifest.json":"delivery_audit_only","task.duckdb":"tool_host_only","trusted_tools/toolset.json":"tool_host_only","verifier/README.md":"verifier_only","verifier/__init__.py":"verifier_only","verifier/conftest.py":"verifier_only","verifier/oracle_config.json":"verifier_only","verifier/requirements.lock":"verifier_only","verifier/runtime.py":"verifier_only","verifier/test_contract.py":"verifier_only","verifier/test_data_identity.py":"verifier_only","verifier/test_semantics.py":"verifier_only"},"artifacts":{"evaluation_view/manifest.json":"e4030a56a1bf5dcbc030af5611ba8350646c3333ec1e41b3eeea863a1ca8881a","evaluation_view/public/prompt.md":"6baff3a337e0847907fec74efd7bf05ce7096a187b0e770739c9fc57fef7721c","evaluation_view/public/runtime_contract.json":"218a17660817ce9a86e2f0e126bdfae55a7fc962d409192c016c47e850cb2948","evaluation_view/public/submission.schema.json":"3e411c451d6511cd3afafd5373c0edbca33bd736e887c716ceec0dfeb3edbf52","source_manifest.json":"9405cdbd4e21fa055728761209595aaa56f6aaeb7e8d5b1bd4e85256c1774edc","task.duckdb":"2a685f8043f6e26d737352657508518f19e4c1d1301ba7ef3cebaac9719683fa","trusted_tools/toolset.json":"974ee89d8ba51cd345b458396f40fa20aee0172542fd900ebcd6188f346802c6","verifier/README.md":"0f11015dbb7c2c7494c95425d3d7c6d5451da95e0a253e7d22b6378b0ba19870","verifier/__init__.py":"018d3c3857f87e105ed9b17a4bf6405f28aaaf13ee04845976f5d26ba48065ec","verifier/conftest.py":"07ad05acc2b379ccad1b4751b0b0ff172c348be70764e1d27878f52052063e56","verifier/oracle_config.json":"af2afec1027e00816895103e3364eae42f8a373c463d3a25841a26a38953c0ab","verifier/requirements.lock":"df4c512944e19ad7f9df6ab76b0523ef75a14a4ef659941d623f94bfabb3fc17","verifier/runtime.py":"e52e18ebe2403660c73909687bda9703ced5b112f643c295308750cf0c98643c","verifier/test_contract.py":"8b80561ff4cab58892662acf1b5330dddfd9a5006389c8741dfcc53cd0f378a2","verifier/test_data_identity.py":"0a31b79d889bfda62a6004b438593b82e93e0f1811db3a37365c05e82e32ffff","verifier/test_semantics.py":"f290334c25b82579f52dd85ec2f9db7236e8b23890d68fb78073e928c6f54a3d"},"database":{"file_digest":"2a685f8043f6e26d737352657508518f19e4c1d1301ba7ef3cebaac9719683fa","logical_checksum":"e8cc7eba649a417436141870e5584b494a15a2266c1f8d32c7cb3f9b752221ab","market_content_digest":"0ace45ddce2bc9b56853d2831e0f04758cd26f401dc22c3c1b393081250da323","schema_version":"bsm-market-metric-task-duckdb-v2.0.0","snapshot_id":"BSM-MARKET-METRIC-8A72759ED02F91DA19C2D986"},"delivery_status":"PORTABLE_SUITE_VERIFIED","evaluation_view":{"interface_digest":"ad81570db06360fb8f5d68a039d6c5e6ef154480154b56cf455656647b96d6ef","manifest_digest":"e4030a56a1bf5dcbc030af5611ba8350646c3333ec1e41b3eeea863a1ca8881a","path":"evaluation_view"},"method_id":"bsm-mid-iv-bisection80-analytic-theta-1calendar-day-v1","package_schema_version":"agent-task-package-v3.0.0","public_child_snapshot":{"logical_checksum":"e8cc7eba649a417436141870e5584b494a15a2266c1f8d32c7cb3f9b752221ab","revision":1,"snapshot_id":"BSM-MARKET-METRIC-8A72759ED02F91DA19C2D986"},"source_manifest_digest":"9405cdbd4e21fa055728761209595aaa56f6aaeb7e8d5b1bd4e85256c1774edc","source_task_id":"bsm-mig-v2-37b5517a3a43a7936990e233","target_metric":"theta_1calendar_day","task_family":"bsm_greeks","task_id":"bsm-market-theta-1calendar-day-v2-8a72759ed02f91da19c2d986","task_interface_version":"bsm-market-metric-agent-task-v2.0.0","task_version":"2.0.0","toolset":{"digest":"974ee89d8ba51cd345b458396f40fa20aee0172542fd900ebcd6188f346802c6","path":"trusted_tools/toolset.json"},"variant_id":"bsm_market_implied_theta_1calendar_day_v1","verifier":{"id":"quantlib-bsm-market-implied-theta-1calendar-day-verifier-v2","oracle_config_digest":"af2afec1027e00816895103e3364eae42f8a373c463d3a25841a26a38953c0ab","runtime_digest":"e52e18ebe2403660c73909687bda9703ced5b112f643c295308750cf0c98643c"}}
