{"artifact_visibility":{"evaluation_view/manifest.json":"solver_evaluation_view","evaluation_view/public/prompt.md":"solver_evaluation_view","evaluation_view/public/runtime_contract.json":"solver_evaluation_view","evaluation_view/public/submission.schema.json":"solver_evaluation_view","source_manifest.json":"delivery_audit_only","task.duckdb":"tool_host_only","trusted_tools/toolset.json":"tool_host_only","verifier/README.md":"verifier_only","verifier/__init__.py":"verifier_only","verifier/conftest.py":"verifier_only","verifier/oracle_config.json":"verifier_only","verifier/requirements.lock":"verifier_only","verifier/runtime.py":"verifier_only","verifier/test_contract.py":"verifier_only","verifier/test_data_identity.py":"verifier_only","verifier/test_semantics.py":"verifier_only"},"artifacts":{"evaluation_view/manifest.json":"29ae1fd7b4ab7c0f5858e0a45f06e291e4404a7802bc9b2f1e9406252c97293b","evaluation_view/public/prompt.md":"cd3fb621a5d6b5f22b0f7aecbf887beb763a02278550134e3ee6d71d15067496","evaluation_view/public/runtime_contract.json":"218a17660817ce9a86e2f0e126bdfae55a7fc962d409192c016c47e850cb2948","evaluation_view/public/submission.schema.json":"ea93d9786557037e49995aa544b3726d54de02339edb8799290b1c617a672160","source_manifest.json":"bbfbc242c95ebca37c6f92248b273a6f7326775ff3fdc23d6bcba5048cf621f2","task.duckdb":"25062184d1152d4e7439cfbbc3be5a52fb51067138d086c33c53d651c446a8d7","trusted_tools/toolset.json":"3742834d43c0c72cb20696e9a7685d73548607dedac15bf94e7114b0cdc245a1","verifier/README.md":"0f11015dbb7c2c7494c95425d3d7c6d5451da95e0a253e7d22b6378b0ba19870","verifier/__init__.py":"018d3c3857f87e105ed9b17a4bf6405f28aaaf13ee04845976f5d26ba48065ec","verifier/conftest.py":"07ad05acc2b379ccad1b4751b0b0ff172c348be70764e1d27878f52052063e56","verifier/oracle_config.json":"a628049aac857121615aaa2195014c76e06644b8f7c2bce52d0dd40ac59fdaa9","verifier/requirements.lock":"df4c512944e19ad7f9df6ab76b0523ef75a14a4ef659941d623f94bfabb3fc17","verifier/runtime.py":"e52e18ebe2403660c73909687bda9703ced5b112f643c295308750cf0c98643c","verifier/test_contract.py":"8b80561ff4cab58892662acf1b5330dddfd9a5006389c8741dfcc53cd0f378a2","verifier/test_data_identity.py":"0a31b79d889bfda62a6004b438593b82e93e0f1811db3a37365c05e82e32ffff","verifier/test_semantics.py":"f290334c25b82579f52dd85ec2f9db7236e8b23890d68fb78073e928c6f54a3d"},"database":{"file_digest":"25062184d1152d4e7439cfbbc3be5a52fb51067138d086c33c53d651c446a8d7","logical_checksum":"ba60554cfea567e5b9322d76431d2b62d30f64d68fb8e394048a8b53d8a2ce1d","market_content_digest":"3fba717199a2482787724bf36a909786a2eb3541f26eeb02811a2a1bb29f14d8","schema_version":"bsm-market-metric-task-duckdb-v2.0.0","snapshot_id":"BSM-MARKET-METRIC-BC692831EB03787009532218"},"delivery_status":"PORTABLE_SUITE_VERIFIED","evaluation_view":{"interface_digest":"a9a3f622b64a968891d6566d0844581c1bba26e5b701430b7ab6fee73254ebcd","manifest_digest":"29ae1fd7b4ab7c0f5858e0a45f06e291e4404a7802bc9b2f1e9406252c97293b","path":"evaluation_view"},"method_id":"bsm-mid-iv-bisection80-analytic-vega-1volpt-v1","package_schema_version":"agent-task-package-v3.0.0","public_child_snapshot":{"logical_checksum":"ba60554cfea567e5b9322d76431d2b62d30f64d68fb8e394048a8b53d8a2ce1d","revision":1,"snapshot_id":"BSM-MARKET-METRIC-BC692831EB03787009532218"},"source_manifest_digest":"bbfbc242c95ebca37c6f92248b273a6f7326775ff3fdc23d6bcba5048cf621f2","source_task_id":"bsm-mig-v2-ddcdc6dd44ed88a2df0d1f73","target_metric":"vega_1volpt","task_family":"bsm_greeks","task_id":"bsm-market-vega-1volpt-v2-bc692831eb03787009532218","task_interface_version":"bsm-market-metric-agent-task-v2.0.0","task_version":"2.0.0","toolset":{"digest":"3742834d43c0c72cb20696e9a7685d73548607dedac15bf94e7114b0cdc245a1","path":"trusted_tools/toolset.json"},"variant_id":"bsm_market_implied_vega_1volpt_v1","verifier":{"id":"quantlib-bsm-market-implied-vega-1volpt-verifier-v2","oracle_config_digest":"a628049aac857121615aaa2195014c76e06644b8f7c2bce52d0dd40ac59fdaa9","runtime_digest":"e52e18ebe2403660c73909687bda9703ced5b112f643c295308750cf0c98643c"}}
