{"artifact_visibility":{"evaluation_view/manifest.json":"solver_evaluation_view","evaluation_view/public/prompt.md":"solver_evaluation_view","evaluation_view/public/runtime_contract.json":"solver_evaluation_view","evaluation_view/public/submission.schema.json":"solver_evaluation_view","source_manifest.json":"delivery_audit_only","task.duckdb":"tool_host_only","trusted_tools/toolset.json":"tool_host_only","verifier/README.md":"verifier_only","verifier/__init__.py":"verifier_only","verifier/conftest.py":"verifier_only","verifier/oracle_config.json":"verifier_only","verifier/requirements.lock":"verifier_only","verifier/runtime.py":"verifier_only","verifier/test_contract.py":"verifier_only","verifier/test_data_identity.py":"verifier_only","verifier/test_semantics.py":"verifier_only"},"artifacts":{"evaluation_view/manifest.json":"f87afb53598c5f21b910103cafda1f111dafc027433ce966c1a905065a53a524","evaluation_view/public/prompt.md":"cd3fb621a5d6b5f22b0f7aecbf887beb763a02278550134e3ee6d71d15067496","evaluation_view/public/runtime_contract.json":"218a17660817ce9a86e2f0e126bdfae55a7fc962d409192c016c47e850cb2948","evaluation_view/public/submission.schema.json":"ea93d9786557037e49995aa544b3726d54de02339edb8799290b1c617a672160","source_manifest.json":"a5f3c0997d74ffd7abe04c4e4080b825ffac7fae475e29842460e87ed12eee39","task.duckdb":"875c5cf5356f5cf2b533b0ceb3eb12da959345ffbecc0b99192c85c189364109","trusted_tools/toolset.json":"b32679b3f1db8d8b1ece47308614b01f982745c95655ce8a82ab9ff0f72f5194","verifier/README.md":"0f11015dbb7c2c7494c95425d3d7c6d5451da95e0a253e7d22b6378b0ba19870","verifier/__init__.py":"018d3c3857f87e105ed9b17a4bf6405f28aaaf13ee04845976f5d26ba48065ec","verifier/conftest.py":"07ad05acc2b379ccad1b4751b0b0ff172c348be70764e1d27878f52052063e56","verifier/oracle_config.json":"a628049aac857121615aaa2195014c76e06644b8f7c2bce52d0dd40ac59fdaa9","verifier/requirements.lock":"df4c512944e19ad7f9df6ab76b0523ef75a14a4ef659941d623f94bfabb3fc17","verifier/runtime.py":"e52e18ebe2403660c73909687bda9703ced5b112f643c295308750cf0c98643c","verifier/test_contract.py":"8b80561ff4cab58892662acf1b5330dddfd9a5006389c8741dfcc53cd0f378a2","verifier/test_data_identity.py":"0a31b79d889bfda62a6004b438593b82e93e0f1811db3a37365c05e82e32ffff","verifier/test_semantics.py":"f290334c25b82579f52dd85ec2f9db7236e8b23890d68fb78073e928c6f54a3d"},"database":{"file_digest":"875c5cf5356f5cf2b533b0ceb3eb12da959345ffbecc0b99192c85c189364109","logical_checksum":"5cfed0640fe00cbb200f0682dc067c8b025bf621e54bf4bcdbc54c7537171655","market_content_digest":"5354a4de768afc23391f7945fd8e7b797412831a3a2fbef9915ae415824ea53b","schema_version":"bsm-market-metric-task-duckdb-v2.0.0","snapshot_id":"BSM-MARKET-METRIC-E9A511F9CE6CD93630E0B0F6"},"delivery_status":"PORTABLE_SUITE_VERIFIED","evaluation_view":{"interface_digest":"a9a3f622b64a968891d6566d0844581c1bba26e5b701430b7ab6fee73254ebcd","manifest_digest":"f87afb53598c5f21b910103cafda1f111dafc027433ce966c1a905065a53a524","path":"evaluation_view"},"method_id":"bsm-mid-iv-bisection80-analytic-vega-1volpt-v1","package_schema_version":"agent-task-package-v3.0.0","public_child_snapshot":{"logical_checksum":"5cfed0640fe00cbb200f0682dc067c8b025bf621e54bf4bcdbc54c7537171655","revision":1,"snapshot_id":"BSM-MARKET-METRIC-E9A511F9CE6CD93630E0B0F6"},"source_manifest_digest":"a5f3c0997d74ffd7abe04c4e4080b825ffac7fae475e29842460e87ed12eee39","source_task_id":"bsm-mig-v2-7113b9f745a0b744dcb6989a","target_metric":"vega_1volpt","task_family":"bsm_greeks","task_id":"bsm-market-vega-1volpt-v2-e9a511f9ce6cd93630e0b0f6","task_interface_version":"bsm-market-metric-agent-task-v2.0.0","task_version":"2.0.0","toolset":{"digest":"b32679b3f1db8d8b1ece47308614b01f982745c95655ce8a82ab9ff0f72f5194","path":"trusted_tools/toolset.json"},"variant_id":"bsm_market_implied_vega_1volpt_v1","verifier":{"id":"quantlib-bsm-market-implied-vega-1volpt-verifier-v2","oracle_config_digest":"a628049aac857121615aaa2195014c76e06644b8f7c2bce52d0dd40ac59fdaa9","runtime_digest":"e52e18ebe2403660c73909687bda9703ced5b112f643c295308750cf0c98643c"}}
