{"artifact_visibility":{"evaluation_view/manifest.json":"solver_evaluation_view","evaluation_view/public/prompt.md":"solver_evaluation_view","evaluation_view/public/runtime_contract.json":"solver_evaluation_view","evaluation_view/public/submission.schema.json":"solver_evaluation_view","source_manifest.json":"delivery_audit_only","task.duckdb":"tool_host_only","trusted_tools/toolset.json":"tool_host_only","verifier/README.md":"verifier_only","verifier/__init__.py":"verifier_only","verifier/_runtime/__init__.py":"verifier_only","verifier/_runtime/database.py":"verifier_only","verifier/_runtime/models.py":"verifier_only","verifier/_runtime/oracle.py":"verifier_only","verifier/_runtime/profile.py":"verifier_only","verifier/_runtime/submission.py":"verifier_only","verifier/conftest.py":"verifier_only","verifier/oracle_config.json":"verifier_only","verifier/requirements.lock":"verifier_only","verifier/runtime.py":"verifier_only","verifier/test_contract.py":"verifier_only","verifier/test_data_identity.py":"verifier_only","verifier/test_semantics.py":"verifier_only"},"artifacts":{"evaluation_view/manifest.json":"915b7c8c73c15195f02d3705726fc78043b6efec8ca9ba9371af4ed04000fd29","evaluation_view/public/prompt.md":"59ec42cfe078aab3d61b3b95f7d89aae4d2090c6080930de85403ee27d847864","evaluation_view/public/runtime_contract.json":"218a17660817ce9a86e2f0e126bdfae55a7fc962d409192c016c47e850cb2948","evaluation_view/public/submission.schema.json":"be4a9910bd2fdea14550f57a4ced520f7e5747328df1e151a7714d2e42fe5bc7","source_manifest.json":"3ede1552ed7e49ae74adbd77354af4578d9f8b68517bff2410caa3097594680b","task.duckdb":"d9154d695c704ea4e2322fb488760f02f3f7b67ea40cdb4967aef70f1931c536","trusted_tools/toolset.json":"ce11a215c8d8567c09b9b726144eb9fc7a70444e760096342d44640f2a6f5c33","verifier/README.md":"bad4c5b01f36c624cb89f0d4efd318b57f7bc7c780b6d75af9074016f471ca3e","verifier/__init__.py":"018d3c3857f87e105ed9b17a4bf6405f28aaaf13ee04845976f5d26ba48065ec","verifier/_runtime/__init__.py":"0cf58de0233056364ffb69b8ecfb2a15dcadfed8fead05326bafb980cf17718c","verifier/_runtime/database.py":"a2078499879ce3facd5285acda355f79530fa4f91d4165546d403588de2be9f5","verifier/_runtime/models.py":"95209ee508ed3cf597b8a72aed6d9af6390e632414d532447963c9af3a226af9","verifier/_runtime/oracle.py":"6fafa4656283de74bedfe4e88b333725e0504118f8382102479e86ad903cad82","verifier/_runtime/profile.py":"db196de871a4caca940fe52471b958026b9207aac9bbe37eff53a76a87794a16","verifier/_runtime/submission.py":"2c38497ce00d39531d391b9acd907bab69b6e4d23bd25d7c605acc05d6339b30","verifier/conftest.py":"07ad05acc2b379ccad1b4751b0b0ff172c348be70764e1d27878f52052063e56","verifier/oracle_config.json":"4fe70674a1aa59ecfe71907d64b0e607a5a08f974c55d309bc3663a8761e119a","verifier/requirements.lock":"df4c512944e19ad7f9df6ab76b0523ef75a14a4ef659941d623f94bfabb3fc17","verifier/runtime.py":"e4735e46c7001607466f055e449929fad840841a6198353f31d4fcda3b689870","verifier/test_contract.py":"224c7a5cf372cd830427a52f6c1ebe5ff27c8e4d4b14fab1d1e3b77365707895","verifier/test_data_identity.py":"962b43f2f42a747a972055aa790c1cf8ed4e48960a5d1f845225adb4bc37e4b7","verifier/test_semantics.py":"13bc14355704ab8102691120cf02de46f9ddff18d2f5a30a2364cf7cbb7c0a45"},"database":{"file_digest":"d9154d695c704ea4e2322fb488760f02f3f7b67ea40cdb4967aef70f1931c536","logical_checksum":"dd741f307e7a66a20eb08ce1e98df8f2819d9085970a5aaf0c4bcb7f064c1757","market_content_digest":"3f895b91f52897ad726495156f647cf6273dc8fea90b4f440d506b7c2cf397b9","schema_version":"bsm-market-metric-task-duckdb-v2.0.0","snapshot_id":"BSM-MARKET-METRIC-87A87981C2385C6D085D3374"},"delivery_status":"PORTABLE_SUITE_VERIFIED","evaluation_view":{"interface_digest":"6f2983569c844ddec5a79f5056dc03109c57a7cba02d43c35eaa25d87b9af33b","manifest_digest":"915b7c8c73c15195f02d3705726fc78043b6efec8ca9ba9371af4ed04000fd29","path":"evaluation_view"},"method_id":"bsm-mid-iv-bisection80-analytic-gamma-v1","package_schema_version":"agent-task-package-v3.0.0","public_child_snapshot":{"logical_checksum":"dd741f307e7a66a20eb08ce1e98df8f2819d9085970a5aaf0c4bcb7f064c1757","revision":1,"snapshot_id":"BSM-MARKET-METRIC-87A87981C2385C6D085D3374"},"source_manifest_digest":"3ede1552ed7e49ae74adbd77354af4578d9f8b68517bff2410caa3097594680b","source_task_id":"bsm-mig-v2-3eedd97b501acdd7a538eb8f","target_metric":"gamma","task_family":"bsm_greeks","task_id":"bsm-market-gamma-v2-87a87981c2385c6d085d3374","task_interface_version":"bsm-market-metric-agent-task-v2.0.0","task_version":"2.0.0","toolset":{"digest":"ce11a215c8d8567c09b9b726144eb9fc7a70444e760096342d44640f2a6f5c33","path":"trusted_tools/toolset.json"},"variant_id":"bsm_market_implied_gamma_v1","verifier":{"id":"quantlib-bsm-market-implied-gamma-verifier-v2","oracle_config_digest":"4fe70674a1aa59ecfe71907d64b0e607a5a08f974c55d309bc3663a8761e119a","runtime_digest":"e4735e46c7001607466f055e449929fad840841a6198353f31d4fcda3b689870"}}
