{"artifact_visibility":{"evaluation_view/manifest.json":"solver_evaluation_view","evaluation_view/public/prompt.md":"solver_evaluation_view","evaluation_view/public/runtime_contract.json":"solver_evaluation_view","evaluation_view/public/submission.schema.json":"solver_evaluation_view","source_manifest.json":"delivery_audit_only","task.duckdb":"tool_host_only","trusted_tools/toolset.json":"tool_host_only","verifier/README.md":"verifier_only","verifier/__init__.py":"verifier_only","verifier/_runtime/__init__.py":"verifier_only","verifier/_runtime/database.py":"verifier_only","verifier/_runtime/models.py":"verifier_only","verifier/_runtime/oracle.py":"verifier_only","verifier/_runtime/profile.py":"verifier_only","verifier/_runtime/submission.py":"verifier_only","verifier/conftest.py":"verifier_only","verifier/oracle_config.json":"verifier_only","verifier/requirements.lock":"verifier_only","verifier/runtime.py":"verifier_only","verifier/test_contract.py":"verifier_only","verifier/test_data_identity.py":"verifier_only","verifier/test_semantics.py":"verifier_only"},"artifacts":{"evaluation_view/manifest.json":"c87f1bda7fc13459accc1852eb55fbbf87e446009a5299fdff2bf7e9d2fe3361","evaluation_view/public/prompt.md":"6baff3a337e0847907fec74efd7bf05ce7096a187b0e770739c9fc57fef7721c","evaluation_view/public/runtime_contract.json":"218a17660817ce9a86e2f0e126bdfae55a7fc962d409192c016c47e850cb2948","evaluation_view/public/submission.schema.json":"3e411c451d6511cd3afafd5373c0edbca33bd736e887c716ceec0dfeb3edbf52","source_manifest.json":"27ffd0d643a9c3a56e1bb554ba9e110239ab4a3646c953abb450688bc39cc1d4","task.duckdb":"b6fd55dc1dceff51f9ae9a47ede55ff6f32e6e95cbaf63e6ca3736219b502679","trusted_tools/toolset.json":"c3f8912aa33c1874a9ec37f4a5c3f5adcb2bb6e859071a1be3fa76d07b7e3090","verifier/README.md":"bad4c5b01f36c624cb89f0d4efd318b57f7bc7c780b6d75af9074016f471ca3e","verifier/__init__.py":"018d3c3857f87e105ed9b17a4bf6405f28aaaf13ee04845976f5d26ba48065ec","verifier/_runtime/__init__.py":"0cf58de0233056364ffb69b8ecfb2a15dcadfed8fead05326bafb980cf17718c","verifier/_runtime/database.py":"a2078499879ce3facd5285acda355f79530fa4f91d4165546d403588de2be9f5","verifier/_runtime/models.py":"95209ee508ed3cf597b8a72aed6d9af6390e632414d532447963c9af3a226af9","verifier/_runtime/oracle.py":"6fafa4656283de74bedfe4e88b333725e0504118f8382102479e86ad903cad82","verifier/_runtime/profile.py":"db196de871a4caca940fe52471b958026b9207aac9bbe37eff53a76a87794a16","verifier/_runtime/submission.py":"2c38497ce00d39531d391b9acd907bab69b6e4d23bd25d7c605acc05d6339b30","verifier/conftest.py":"07ad05acc2b379ccad1b4751b0b0ff172c348be70764e1d27878f52052063e56","verifier/oracle_config.json":"af2afec1027e00816895103e3364eae42f8a373c463d3a25841a26a38953c0ab","verifier/requirements.lock":"df4c512944e19ad7f9df6ab76b0523ef75a14a4ef659941d623f94bfabb3fc17","verifier/runtime.py":"e4735e46c7001607466f055e449929fad840841a6198353f31d4fcda3b689870","verifier/test_contract.py":"224c7a5cf372cd830427a52f6c1ebe5ff27c8e4d4b14fab1d1e3b77365707895","verifier/test_data_identity.py":"962b43f2f42a747a972055aa790c1cf8ed4e48960a5d1f845225adb4bc37e4b7","verifier/test_semantics.py":"13bc14355704ab8102691120cf02de46f9ddff18d2f5a30a2364cf7cbb7c0a45"},"database":{"file_digest":"b6fd55dc1dceff51f9ae9a47ede55ff6f32e6e95cbaf63e6ca3736219b502679","logical_checksum":"018c7e99aa9beb84b1fee50d1702ebad0e30b01222aa29e920794ff41cb153fa","market_content_digest":"c59342ad47e5151239399857f8c9f3152e9eb08d330a8d5056dc00a4861d183b","schema_version":"bsm-market-metric-task-duckdb-v2.0.0","snapshot_id":"BSM-MARKET-METRIC-6068CFF10F66517199AE175D"},"delivery_status":"PORTABLE_SUITE_VERIFIED","evaluation_view":{"interface_digest":"ad81570db06360fb8f5d68a039d6c5e6ef154480154b56cf455656647b96d6ef","manifest_digest":"c87f1bda7fc13459accc1852eb55fbbf87e446009a5299fdff2bf7e9d2fe3361","path":"evaluation_view"},"method_id":"bsm-mid-iv-bisection80-analytic-theta-1calendar-day-v1","package_schema_version":"agent-task-package-v3.0.0","public_child_snapshot":{"logical_checksum":"018c7e99aa9beb84b1fee50d1702ebad0e30b01222aa29e920794ff41cb153fa","revision":1,"snapshot_id":"BSM-MARKET-METRIC-6068CFF10F66517199AE175D"},"source_manifest_digest":"27ffd0d643a9c3a56e1bb554ba9e110239ab4a3646c953abb450688bc39cc1d4","source_task_id":"bsm-mig-v2-f4b10525bfa8d076f516110c","target_metric":"theta_1calendar_day","task_family":"bsm_greeks","task_id":"bsm-market-theta-1calendar-day-v2-6068cff10f66517199ae175d","task_interface_version":"bsm-market-metric-agent-task-v2.0.0","task_version":"2.0.0","toolset":{"digest":"c3f8912aa33c1874a9ec37f4a5c3f5adcb2bb6e859071a1be3fa76d07b7e3090","path":"trusted_tools/toolset.json"},"variant_id":"bsm_market_implied_theta_1calendar_day_v1","verifier":{"id":"quantlib-bsm-market-implied-theta-1calendar-day-verifier-v2","oracle_config_digest":"af2afec1027e00816895103e3364eae42f8a373c463d3a25841a26a38953c0ab","runtime_digest":"e4735e46c7001607466f055e449929fad840841a6198353f31d4fcda3b689870"}}
