{"artifact_visibility":{"evaluation_view/manifest.json":"solver_evaluation_view","evaluation_view/public/prompt.md":"solver_evaluation_view","evaluation_view/public/runtime_contract.json":"solver_evaluation_view","evaluation_view/public/submission.schema.json":"solver_evaluation_view","source_manifest.json":"delivery_audit_only","task.duckdb":"tool_host_only","trusted_tools/toolset.json":"tool_host_only","verifier/README.md":"verifier_only","verifier/__init__.py":"verifier_only","verifier/_runtime/__init__.py":"verifier_only","verifier/_runtime/database.py":"verifier_only","verifier/_runtime/models.py":"verifier_only","verifier/_runtime/oracle.py":"verifier_only","verifier/_runtime/profile.py":"verifier_only","verifier/_runtime/submission.py":"verifier_only","verifier/conftest.py":"verifier_only","verifier/oracle_config.json":"verifier_only","verifier/requirements.lock":"verifier_only","verifier/runtime.py":"verifier_only","verifier/test_contract.py":"verifier_only","verifier/test_data_identity.py":"verifier_only","verifier/test_semantics.py":"verifier_only"},"artifacts":{"evaluation_view/manifest.json":"1557c7029aa5c9fc5ca22f2cb44bee4d982edba54815fac77d9fbf1e6bab8ab9","evaluation_view/public/prompt.md":"b2ad075fa254fefcc1a826c4fd07da48667953c994f61489f82a65fae771797d","evaluation_view/public/runtime_contract.json":"218a17660817ce9a86e2f0e126bdfae55a7fc962d409192c016c47e850cb2948","evaluation_view/public/submission.schema.json":"dea7dcfeadcb76c0f12e9004002a08555ecaa6cc33f3fabe55cedb68f17ae97c","source_manifest.json":"d197941382537229edc635c38e34db55055396da31bac53d971676a2e51feebd","task.duckdb":"62093a74780605e3e4a5630285cd4e78a8a6ac81d9ef960992dd2454f6b918f9","trusted_tools/toolset.json":"3bca46953b6c7a3b7e032f2aea5974bd71a073b96c7ff80bb6cf4382b81eed8c","verifier/README.md":"bad4c5b01f36c624cb89f0d4efd318b57f7bc7c780b6d75af9074016f471ca3e","verifier/__init__.py":"018d3c3857f87e105ed9b17a4bf6405f28aaaf13ee04845976f5d26ba48065ec","verifier/_runtime/__init__.py":"0cf58de0233056364ffb69b8ecfb2a15dcadfed8fead05326bafb980cf17718c","verifier/_runtime/database.py":"a2078499879ce3facd5285acda355f79530fa4f91d4165546d403588de2be9f5","verifier/_runtime/models.py":"95209ee508ed3cf597b8a72aed6d9af6390e632414d532447963c9af3a226af9","verifier/_runtime/oracle.py":"6fafa4656283de74bedfe4e88b333725e0504118f8382102479e86ad903cad82","verifier/_runtime/profile.py":"db196de871a4caca940fe52471b958026b9207aac9bbe37eff53a76a87794a16","verifier/_runtime/submission.py":"2c38497ce00d39531d391b9acd907bab69b6e4d23bd25d7c605acc05d6339b30","verifier/conftest.py":"07ad05acc2b379ccad1b4751b0b0ff172c348be70764e1d27878f52052063e56","verifier/oracle_config.json":"e65765876adf356958a0faf7631f1ec20f469fc8bca141da18d6bce4514f5ba2","verifier/requirements.lock":"df4c512944e19ad7f9df6ab76b0523ef75a14a4ef659941d623f94bfabb3fc17","verifier/runtime.py":"e4735e46c7001607466f055e449929fad840841a6198353f31d4fcda3b689870","verifier/test_contract.py":"224c7a5cf372cd830427a52f6c1ebe5ff27c8e4d4b14fab1d1e3b77365707895","verifier/test_data_identity.py":"962b43f2f42a747a972055aa790c1cf8ed4e48960a5d1f845225adb4bc37e4b7","verifier/test_semantics.py":"13bc14355704ab8102691120cf02de46f9ddff18d2f5a30a2364cf7cbb7c0a45"},"database":{"file_digest":"62093a74780605e3e4a5630285cd4e78a8a6ac81d9ef960992dd2454f6b918f9","logical_checksum":"9415f3342b4f0df26aa3fcd0ba76ae229f8b7f006dcf1305339a54963566acd0","market_content_digest":"d27cbe0c102c6d4267513773c269896ed8ee976581a040863293859251e91de4","schema_version":"bsm-market-metric-task-duckdb-v2.0.0","snapshot_id":"BSM-MARKET-METRIC-4BBEDE604882A66A6DF0D498"},"delivery_status":"PORTABLE_SUITE_VERIFIED","evaluation_view":{"interface_digest":"a98945600c0f5fed7a6e6b9552a18235398d8817eb9af8aa728daeda714babfd","manifest_digest":"1557c7029aa5c9fc5ca22f2cb44bee4d982edba54815fac77d9fbf1e6bab8ab9","path":"evaluation_view"},"method_id":"bsm-mid-iv-bisection80-analytic-delta-v1","package_schema_version":"agent-task-package-v3.0.0","public_child_snapshot":{"logical_checksum":"9415f3342b4f0df26aa3fcd0ba76ae229f8b7f006dcf1305339a54963566acd0","revision":1,"snapshot_id":"BSM-MARKET-METRIC-4BBEDE604882A66A6DF0D498"},"source_manifest_digest":"d197941382537229edc635c38e34db55055396da31bac53d971676a2e51feebd","source_task_id":"bsm-mig-v2-be9b54f90b3200b7faae8389","target_metric":"delta","task_family":"bsm_greeks","task_id":"bsm-market-delta-v2-4bbede604882a66a6df0d498","task_interface_version":"bsm-market-metric-agent-task-v2.0.0","task_version":"2.0.0","toolset":{"digest":"3bca46953b6c7a3b7e032f2aea5974bd71a073b96c7ff80bb6cf4382b81eed8c","path":"trusted_tools/toolset.json"},"variant_id":"bsm_market_implied_delta_v1","verifier":{"id":"quantlib-bsm-market-implied-delta-verifier-v2","oracle_config_digest":"e65765876adf356958a0faf7631f1ec20f469fc8bca141da18d6bce4514f5ba2","runtime_digest":"e4735e46c7001607466f055e449929fad840841a6198353f31d4fcda3b689870"}}
