{"artifact_visibility":{"evaluation_view/manifest.json":"solver_evaluation_view","evaluation_view/public/prompt.md":"solver_evaluation_view","evaluation_view/public/runtime_contract.json":"solver_evaluation_view","evaluation_view/public/submission.schema.json":"solver_evaluation_view","source_manifest.json":"delivery_audit_only","task.duckdb":"tool_host_only","trusted_tools/toolset.json":"tool_host_only","verifier/README.md":"verifier_only","verifier/__init__.py":"verifier_only","verifier/_runtime/__init__.py":"verifier_only","verifier/_runtime/database.py":"verifier_only","verifier/_runtime/models.py":"verifier_only","verifier/_runtime/oracle.py":"verifier_only","verifier/_runtime/profile.py":"verifier_only","verifier/_runtime/submission.py":"verifier_only","verifier/conftest.py":"verifier_only","verifier/oracle_config.json":"verifier_only","verifier/requirements.lock":"verifier_only","verifier/runtime.py":"verifier_only","verifier/test_contract.py":"verifier_only","verifier/test_data_identity.py":"verifier_only","verifier/test_semantics.py":"verifier_only"},"artifacts":{"evaluation_view/manifest.json":"761857218a8e71c5db4b29cd453ff5a9e8ad47d18e33b4204ca0a2ddf4ee1182","evaluation_view/public/prompt.md":"cd3fb621a5d6b5f22b0f7aecbf887beb763a02278550134e3ee6d71d15067496","evaluation_view/public/runtime_contract.json":"218a17660817ce9a86e2f0e126bdfae55a7fc962d409192c016c47e850cb2948","evaluation_view/public/submission.schema.json":"ea93d9786557037e49995aa544b3726d54de02339edb8799290b1c617a672160","source_manifest.json":"91d5bc987027920c73e2733397e03675e9dcbc30aff6877f1f19a4e40667826a","task.duckdb":"a832676a936d6f7123d1e83034dade342b157874328fc968a0cdfcfc0d6c336b","trusted_tools/toolset.json":"7b063e7f7b2caaab221a56f9aaa28de632975af8bd7397c71111ce77d5c18636","verifier/README.md":"bad4c5b01f36c624cb89f0d4efd318b57f7bc7c780b6d75af9074016f471ca3e","verifier/__init__.py":"018d3c3857f87e105ed9b17a4bf6405f28aaaf13ee04845976f5d26ba48065ec","verifier/_runtime/__init__.py":"0cf58de0233056364ffb69b8ecfb2a15dcadfed8fead05326bafb980cf17718c","verifier/_runtime/database.py":"a2078499879ce3facd5285acda355f79530fa4f91d4165546d403588de2be9f5","verifier/_runtime/models.py":"95209ee508ed3cf597b8a72aed6d9af6390e632414d532447963c9af3a226af9","verifier/_runtime/oracle.py":"6fafa4656283de74bedfe4e88b333725e0504118f8382102479e86ad903cad82","verifier/_runtime/profile.py":"db196de871a4caca940fe52471b958026b9207aac9bbe37eff53a76a87794a16","verifier/_runtime/submission.py":"2c38497ce00d39531d391b9acd907bab69b6e4d23bd25d7c605acc05d6339b30","verifier/conftest.py":"07ad05acc2b379ccad1b4751b0b0ff172c348be70764e1d27878f52052063e56","verifier/oracle_config.json":"a628049aac857121615aaa2195014c76e06644b8f7c2bce52d0dd40ac59fdaa9","verifier/requirements.lock":"df4c512944e19ad7f9df6ab76b0523ef75a14a4ef659941d623f94bfabb3fc17","verifier/runtime.py":"e4735e46c7001607466f055e449929fad840841a6198353f31d4fcda3b689870","verifier/test_contract.py":"224c7a5cf372cd830427a52f6c1ebe5ff27c8e4d4b14fab1d1e3b77365707895","verifier/test_data_identity.py":"962b43f2f42a747a972055aa790c1cf8ed4e48960a5d1f845225adb4bc37e4b7","verifier/test_semantics.py":"13bc14355704ab8102691120cf02de46f9ddff18d2f5a30a2364cf7cbb7c0a45"},"database":{"file_digest":"a832676a936d6f7123d1e83034dade342b157874328fc968a0cdfcfc0d6c336b","logical_checksum":"3f443f2ec436d63c1895f1e5b73ebe11d967e5ca4c12a6314b8266cd46717b62","market_content_digest":"5f73b52675288e3cb412f44c0eb8f01c389155cb3176675338cacea9104b2648","schema_version":"bsm-market-metric-task-duckdb-v2.0.0","snapshot_id":"BSM-MARKET-METRIC-61AD46ABDF877A3CBC348E30"},"delivery_status":"PORTABLE_SUITE_VERIFIED","evaluation_view":{"interface_digest":"a9a3f622b64a968891d6566d0844581c1bba26e5b701430b7ab6fee73254ebcd","manifest_digest":"761857218a8e71c5db4b29cd453ff5a9e8ad47d18e33b4204ca0a2ddf4ee1182","path":"evaluation_view"},"method_id":"bsm-mid-iv-bisection80-analytic-vega-1volpt-v1","package_schema_version":"agent-task-package-v3.0.0","public_child_snapshot":{"logical_checksum":"3f443f2ec436d63c1895f1e5b73ebe11d967e5ca4c12a6314b8266cd46717b62","revision":1,"snapshot_id":"BSM-MARKET-METRIC-61AD46ABDF877A3CBC348E30"},"source_manifest_digest":"91d5bc987027920c73e2733397e03675e9dcbc30aff6877f1f19a4e40667826a","source_task_id":"bsm-mig-v2-294167a3ca9ced3b642dae8a","target_metric":"vega_1volpt","task_family":"bsm_greeks","task_id":"bsm-market-vega-1volpt-v2-61ad46abdf877a3cbc348e30","task_interface_version":"bsm-market-metric-agent-task-v2.0.0","task_version":"2.0.0","toolset":{"digest":"7b063e7f7b2caaab221a56f9aaa28de632975af8bd7397c71111ce77d5c18636","path":"trusted_tools/toolset.json"},"variant_id":"bsm_market_implied_vega_1volpt_v1","verifier":{"id":"quantlib-bsm-market-implied-vega-1volpt-verifier-v2","oracle_config_digest":"a628049aac857121615aaa2195014c76e06644b8f7c2bce52d0dd40ac59fdaa9","runtime_digest":"e4735e46c7001607466f055e449929fad840841a6198353f31d4fcda3b689870"}}
