{"artifact_visibility":{"evaluation_view/manifest.json":"solver_evaluation_view","evaluation_view/public/prompt.md":"solver_evaluation_view","evaluation_view/public/runtime_contract.json":"solver_evaluation_view","evaluation_view/public/submission.schema.json":"solver_evaluation_view","source_manifest.json":"delivery_audit_only","task.duckdb":"tool_host_only","trusted_tools/toolset.json":"tool_host_only","verifier/README.md":"verifier_only","verifier/__init__.py":"verifier_only","verifier/conftest.py":"verifier_only","verifier/oracle_config.json":"verifier_only","verifier/requirements.lock":"verifier_only","verifier/runtime.py":"verifier_only","verifier/test_contract.py":"verifier_only","verifier/test_data_identity.py":"verifier_only","verifier/test_semantics.py":"verifier_only"},"artifacts":{"evaluation_view/manifest.json":"71fa9c9f6aed76925cc9268fa5a3f1e05f3a7e48086be6635dd26d11d82f2022","evaluation_view/public/prompt.md":"6baff3a337e0847907fec74efd7bf05ce7096a187b0e770739c9fc57fef7721c","evaluation_view/public/runtime_contract.json":"218a17660817ce9a86e2f0e126bdfae55a7fc962d409192c016c47e850cb2948","evaluation_view/public/submission.schema.json":"3e411c451d6511cd3afafd5373c0edbca33bd736e887c716ceec0dfeb3edbf52","source_manifest.json":"9c536f646f5997455432b2277b0240415667cc5af30697f57cb535654586d96f","task.duckdb":"641ba25b95a57ce3d4f911272d970ac5bb3cf3bbbb36e3a8bd3bfd6a9d281e15","trusted_tools/toolset.json":"fbe97b240f5ebda245bf5a895c17f20ea905bf32e683b26be6c220fe5f443793","verifier/README.md":"0f11015dbb7c2c7494c95425d3d7c6d5451da95e0a253e7d22b6378b0ba19870","verifier/__init__.py":"018d3c3857f87e105ed9b17a4bf6405f28aaaf13ee04845976f5d26ba48065ec","verifier/conftest.py":"07ad05acc2b379ccad1b4751b0b0ff172c348be70764e1d27878f52052063e56","verifier/oracle_config.json":"af2afec1027e00816895103e3364eae42f8a373c463d3a25841a26a38953c0ab","verifier/requirements.lock":"df4c512944e19ad7f9df6ab76b0523ef75a14a4ef659941d623f94bfabb3fc17","verifier/runtime.py":"e52e18ebe2403660c73909687bda9703ced5b112f643c295308750cf0c98643c","verifier/test_contract.py":"8b80561ff4cab58892662acf1b5330dddfd9a5006389c8741dfcc53cd0f378a2","verifier/test_data_identity.py":"0a31b79d889bfda62a6004b438593b82e93e0f1811db3a37365c05e82e32ffff","verifier/test_semantics.py":"f290334c25b82579f52dd85ec2f9db7236e8b23890d68fb78073e928c6f54a3d"},"database":{"file_digest":"641ba25b95a57ce3d4f911272d970ac5bb3cf3bbbb36e3a8bd3bfd6a9d281e15","logical_checksum":"2e781016dfe127af31e523ba4a100041f3216657d619cc634c2a2fc3586ecf02","market_content_digest":"d47b2cb848b8de9542631d745f8a7d6d61f154d3a40f71fdc41b5f8d641fe564","schema_version":"bsm-market-metric-task-duckdb-v2.0.0","snapshot_id":"BSM-MARKET-METRIC-3B21E6756881614073BA6922"},"delivery_status":"PORTABLE_SUITE_VERIFIED","evaluation_view":{"interface_digest":"ad81570db06360fb8f5d68a039d6c5e6ef154480154b56cf455656647b96d6ef","manifest_digest":"71fa9c9f6aed76925cc9268fa5a3f1e05f3a7e48086be6635dd26d11d82f2022","path":"evaluation_view"},"method_id":"bsm-mid-iv-bisection80-analytic-theta-1calendar-day-v1","package_schema_version":"agent-task-package-v3.0.0","public_child_snapshot":{"logical_checksum":"2e781016dfe127af31e523ba4a100041f3216657d619cc634c2a2fc3586ecf02","revision":1,"snapshot_id":"BSM-MARKET-METRIC-3B21E6756881614073BA6922"},"source_manifest_digest":"9c536f646f5997455432b2277b0240415667cc5af30697f57cb535654586d96f","source_task_id":"bsm-mig-v2-8711ca872c36c1eaca519059","target_metric":"theta_1calendar_day","task_family":"bsm_greeks","task_id":"bsm-market-theta-1calendar-day-v2-3b21e6756881614073ba6922","task_interface_version":"bsm-market-metric-agent-task-v2.0.0","task_version":"2.0.0","toolset":{"digest":"fbe97b240f5ebda245bf5a895c17f20ea905bf32e683b26be6c220fe5f443793","path":"trusted_tools/toolset.json"},"variant_id":"bsm_market_implied_theta_1calendar_day_v1","verifier":{"id":"quantlib-bsm-market-implied-theta-1calendar-day-verifier-v2","oracle_config_digest":"af2afec1027e00816895103e3364eae42f8a373c463d3a25841a26a38953c0ab","runtime_digest":"e52e18ebe2403660c73909687bda9703ced5b112f643c295308750cf0c98643c"}}
