{"artifact_visibility":{"evaluation_view/manifest.json":"solver_evaluation_view","evaluation_view/public/prompt.md":"solver_evaluation_view","evaluation_view/public/runtime_contract.json":"solver_evaluation_view","evaluation_view/public/submission.schema.json":"solver_evaluation_view","source_manifest.json":"delivery_audit_only","task.duckdb":"tool_host_only","trusted_tools/toolset.json":"tool_host_only","verifier/README.md":"verifier_only","verifier/__init__.py":"verifier_only","verifier/conftest.py":"verifier_only","verifier/oracle_config.json":"verifier_only","verifier/requirements.lock":"verifier_only","verifier/runtime.py":"verifier_only","verifier/test_contract.py":"verifier_only","verifier/test_data_identity.py":"verifier_only","verifier/test_semantics.py":"verifier_only"},"artifacts":{"evaluation_view/manifest.json":"8e11f798d368b4559efa8ab528c7704b32125846c856e01f0a13d3d877b508eb","evaluation_view/public/prompt.md":"efac38a4c27c2c17c966b699c442a5182b55a1266d00738a825e1cade692d8b4","evaluation_view/public/runtime_contract.json":"218a17660817ce9a86e2f0e126bdfae55a7fc962d409192c016c47e850cb2948","evaluation_view/public/submission.schema.json":"0ff5987223743c65e8cf57328037fff0bfc18af7eabda2aed43afef71deb0603","source_manifest.json":"b6f2b1b60e68899c3fb237f760472ada1d06032c1c3f40766f2cedf94eafd3fd","task.duckdb":"7ccf23a4e3e8ac4565f588be84df2f617951755e5f3c16e2a4690cec62945fc0","trusted_tools/toolset.json":"fccfbca6a7ab6e95c4b86b8d2887e9cf23015c896a459a19506232adb08727f1","verifier/README.md":"0f11015dbb7c2c7494c95425d3d7c6d5451da95e0a253e7d22b6378b0ba19870","verifier/__init__.py":"018d3c3857f87e105ed9b17a4bf6405f28aaaf13ee04845976f5d26ba48065ec","verifier/conftest.py":"07ad05acc2b379ccad1b4751b0b0ff172c348be70764e1d27878f52052063e56","verifier/oracle_config.json":"404133266a2fab4076764d41f8590a1307c06af4968515de66b608038ff4d788","verifier/requirements.lock":"df4c512944e19ad7f9df6ab76b0523ef75a14a4ef659941d623f94bfabb3fc17","verifier/runtime.py":"e52e18ebe2403660c73909687bda9703ced5b112f643c295308750cf0c98643c","verifier/test_contract.py":"8b80561ff4cab58892662acf1b5330dddfd9a5006389c8741dfcc53cd0f378a2","verifier/test_data_identity.py":"0a31b79d889bfda62a6004b438593b82e93e0f1811db3a37365c05e82e32ffff","verifier/test_semantics.py":"f290334c25b82579f52dd85ec2f9db7236e8b23890d68fb78073e928c6f54a3d"},"database":{"file_digest":"7ccf23a4e3e8ac4565f588be84df2f617951755e5f3c16e2a4690cec62945fc0","logical_checksum":"5a3090bee2f717520aae7d1c0c580390ac15e9ab212a61e7b9e01af558e052fb","market_content_digest":"d5bd7286170ba16809dd1b89493355aaa69b54d503be42d9748e6443a8099fda","schema_version":"bsm-market-metric-task-duckdb-v2.0.0","snapshot_id":"BSM-MARKET-METRIC-74E2CECA3D1C058A85B3E215"},"delivery_status":"PORTABLE_SUITE_VERIFIED","evaluation_view":{"interface_digest":"84f025226cbf3ca29ad06e7cedb8f01aa1aa048e1b94b1df1675847d6244cffb","manifest_digest":"8e11f798d368b4559efa8ab528c7704b32125846c856e01f0a13d3d877b508eb","path":"evaluation_view"},"method_id":"bsm-mid-iv-bisection80-v1","package_schema_version":"agent-task-package-v3.0.0","public_child_snapshot":{"logical_checksum":"5a3090bee2f717520aae7d1c0c580390ac15e9ab212a61e7b9e01af558e052fb","revision":1,"snapshot_id":"BSM-MARKET-METRIC-74E2CECA3D1C058A85B3E215"},"source_manifest_digest":"b6f2b1b60e68899c3fb237f760472ada1d06032c1c3f40766f2cedf94eafd3fd","source_task_id":"bsm-mig-v2-798d83000adac975905e6a14","target_metric":"iv","task_family":"bsm_greeks","task_id":"bsm-market-iv-v2-74e2ceca3d1c058a85b3e215","task_interface_version":"bsm-market-metric-agent-task-v2.0.0","task_version":"2.0.0","toolset":{"digest":"fccfbca6a7ab6e95c4b86b8d2887e9cf23015c896a459a19506232adb08727f1","path":"trusted_tools/toolset.json"},"variant_id":"bsm_market_implied_iv_v1","verifier":{"id":"quantlib-bsm-market-implied-iv-verifier-v2","oracle_config_digest":"404133266a2fab4076764d41f8590a1307c06af4968515de66b608038ff4d788","runtime_digest":"e52e18ebe2403660c73909687bda9703ced5b112f643c295308750cf0c98643c"}}
